"Authors","Author full names","Author(s) ID","Title","Year","Source title","Volume","Issue","Art. No.","Page start","Page end","Page count","Cited by","DOI","Link","Document Type","Publication Stage","Open Access","Source","EID"
"Potok M.; Chen C.-Y.; Mitra S.; Mohan S.","Potok, Matthew (56585891400); Chen, Chien-Ying (57189459371); Mitra, Sayan (24463145900); Mohan, Sibin (8923995300)","56585891400; 57189459371; 24463145900; 8923995300","SDCWorks: A Formal Framework for Software Defined Control of Smart Manufacturing Systems","2018","Proceedings - 9th ACM/IEEE International Conference on Cyber-Physical Systems, ICCPS 2018","","","8443724","88","97","9","8","10.1109/ICCPS.2018.00017","https://www.scopus.com/inward/record.uri?eid=2-s2.0-85053511971&doi=10.1109%2fICCPS.2018.00017&partnerID=40&md5=31f5de6df22856a2a020d4a0ce731cfb","Conference paper","Final","","Scopus","2-s2.0-85053511971"
"Lechuga G.P.; Sánchez F.M.","Lechuga, Gilberto Pérez (12796024200); Sánchez, Francisco Martínez (57204160605)","12796024200; 57204160605","Modeling and Optimization of Flexible Manufacturing Systems: A Stochastic Approach","2019","Advances in Intelligent Systems and Computing","866","","","539","546","7","5","10.1007/978-3-030-00979-3_57","https://www.scopus.com/inward/record.uri?eid=2-s2.0-85054707034&doi=10.1007%2f978-3-030-00979-3_57&partnerID=40&md5=52469762cec93feca1438f9667ba3ec4","Conference paper","Final","","Scopus","2-s2.0-85054707034"
"Nagadi K.; Rabelo L.; Basingab M.; Sarmiento A.T.; Jones A.; Rahal A.","Nagadi, Khalid (57188753513); Rabelo, Luis (7004646073); Basingab, Mohammed (57197831724); Sarmiento, Alfonso T. (23012990900); Jones, Albert (7407104363); Rahal, Ahmad (55532332000)","57188753513; 7004646073; 57197831724; 23012990900; 7407104363; 55532332000","A hybrid simulation-based assessment framework of smart manufacturing systems","2018","International Journal of Computer Integrated Manufacturing","31","2","","115","128","13","27","10.1080/0951192X.2017.1407449","https://www.scopus.com/inward/record.uri?eid=2-s2.0-85035104229&doi=10.1080%2f0951192X.2017.1407449&partnerID=40&md5=1eefe8edcc091a121ef52c0b67180b9e","Article","Final","","Scopus","2-s2.0-85035104229"
"Chakraborty A.; Bhattacharyya S.; De D.; Mahmud M.; Banerjee J.S.","Chakraborty, Arpita (57192713269); Bhattacharyya, Siddhartha (7402157487); De, Debashis (16177578800); Mahmud, Mufti (35173453700); Banerjee, Jyoti Sekhar (56016851400)","57192713269; 7402157487; 16177578800; 35173453700; 56016851400","Intelligent Automation Framework Using AI and RPA: An Introduction","2023","Smart Innovation, Systems and Technologies","335","","","1","13","12","0","10.1007/978-981-19-8296-5_1","https://www.scopus.com/inward/record.uri?eid=2-s2.0-85151254323&doi=10.1007%2f978-981-19-8296-5_1&partnerID=40&md5=e4d04c4f9e9c0178a0d831ae2ecc8476","Book chapter","Final","","Scopus","2-s2.0-85151254323"
"Mahmoud M.A.; Grace J.","Mahmoud, Moamin A. (55247787300); Grace, Jennifer (57210261059)","55247787300; 57210261059","Towards the adoption of smart manufacturing systems: A development framework","2019","International Journal of Advanced Computer Science and Applications","10","7","","29","35","6","4","10.14569/ijacsa.2019.0100705","https://www.scopus.com/inward/record.uri?eid=2-s2.0-85070061617&doi=10.14569%2fijacsa.2019.0100705&partnerID=40&md5=31de3a2221d675c280e11bae6e63c11c","Article","Final","All Open Access; Gold Open Access; Green Open Access","Scopus","2-s2.0-85070061617"
"López-Juárez I.; Rios-Cabrera R.; Mendez G.M.; Rutiaga-Quezada M.","López-Juárez, I. (6507474784); Rios-Cabrera, R. (8961092400); Mendez, G.M. (56000779000); Rutiaga-Quezada, M. (58313046800)","6507474784; 8961092400; 56000779000; 58313046800","Modeling and object recognition skill transfer in industrial intelligent robots","2023","Reliability Modeling in Industry 4.0","","","","145","182","37","0","10.1016/B978-0-323-99204-6.00017-0","https://www.scopus.com/inward/record.uri?eid=2-s2.0-85161863278&doi=10.1016%2fB978-0-323-99204-6.00017-0&partnerID=40&md5=187a847dfaba41705e36d6e58177f4a6","Book chapter","Final","","Scopus","2-s2.0-85161863278"
"Hajjem E.; Benderbal H.H.; Hamani N.; Dolgui A.","Hajjem, Emna (57265252900); Benderbal, Hichem Haddou (57191657882); Hamani, Nadia (19639987600); Dolgui, Alexandre (57201190890)","57265252900; 57191657882; 19639987600; 57201190890","Digital Twin Framework for Reconfigurable Manufacturing Systems: Challenges and Requirements","2021","IFIP Advances in Information and Communication Technology","631 IFIP","","","553","562","9","2","10.1007/978-3-030-85902-2_59","https://www.scopus.com/inward/record.uri?eid=2-s2.0-85115228350&doi=10.1007%2f978-3-030-85902-2_59&partnerID=40&md5=5a1b9903830557281b607546e7f1ba9c","Conference paper","Final","","Scopus","2-s2.0-85115228350"
"Xiao Y.; Zeng Z.","Xiao, Yue (56004069800); Zeng, Zhiqing (57352972100)","56004069800; 57352972100","A Construction Method of Intelligent Manufacturing System under Industry 4.0 Model","2021","Scientific Programming","2021","","4775237","","","","1","10.1155/2021/4775237","https://www.scopus.com/inward/record.uri?eid=2-s2.0-85119934236&doi=10.1155%2f2021%2f4775237&partnerID=40&md5=78cb5a2a8914a976047db1414dbdf4c0","Article","Final","All Open Access; Gold Open Access","Scopus","2-s2.0-85119934236"
"Xiao B.; Li F.","Xiao, Bing (57562605600); Li, Fang (56366142800)","57562605600; 56366142800","Knowledge-based formal modeling for CPPS in personalized intelligent manufacturing","2021","Proceedings - 2021 IEEE International Conference on Dependable, Autonomic and Secure Computing, International Conference on Pervasive Intelligence and Computing, International Conference on Cloud and Big Data Computing and International Conference on Cyber Science and Technology Congress, DASC/PiCom/CBDCom/CyberSciTech 2021","","","","371","378","7","1","10.1109/DASC-PICom-CBDCom-CyberSciTech52372.2021.00070","https://www.scopus.com/inward/record.uri?eid=2-s2.0-85127575013&doi=10.1109%2fDASC-PICom-CBDCom-CyberSciTech52372.2021.00070&partnerID=40&md5=2d71c45713655d8b4cd34af9b146e067","Conference paper","Final","","Scopus","2-s2.0-85127575013"
